{
  "apply_mode": "real_apply",
  "external_receipt": {
    "chat_id": "5524172309",
    "message_id": "4209",
    "mirrored": true,
    "note": "Sent to telegram home channel (chat_id: 5524172309)",
    "platform": "telegram",
    "success": true
  },
  "operation": "send_system_test_message",
  "post_apply_readback": {
    "chat_id": "5524172309",
    "message_id_present": true,
    "tool_result_received": true,
    "verified": true
  },
  "receipt_id": "tdisp_4209",
  "rollback_evidence_required": true,
  "target_adapter": "telegram_notification",
  "verification_status": "PASS"
}
